Company Name,ROC registration number,Incorporation year,Industry group code,Industry type,NIC name,Main product/service group,NIC code,Size decile,ISIN code
Vivimed Labs Ltd.,Aug-65,1988,1.01012E+14,1,"Manufacture of photographic plates, films, sensitized paper and other sensitized unexposed materials,chemical preparations for photographic uses",Chemicals for photographic uses,20294,Decile 2,INE526G01021
Voltamp Transformers Ltd.,04-1437,1967,1.01014E+14,1,"Manufacture of electric power distribution transformers, arc-welding transformers, fluorescent ballasts, transmission and distribution voltage regulators",Transformers,27102,Decile 2,INE540H01012
Walchandnagar Industries Ltd.,11-291,1908,1.01016E+14,1,Diversified,Diversified manufacturing,34,Decile 2,INE711A01022
Wanbury Ltd.,11-48455,1988,1.01012E+14,1,"Manufacture of pharmaceuticals, medicinal chemical and botanical products","Drugs, medicines & allied products",2100,Decile 2,INE107F01022
Welspun Enterprises Ltd.,04-23920,1994,1.0106E+14,1,Construction of utility projects n.e.c.,Construction of other industrial plants,42209,Decile 2,INE625G01013
Winsome Textile Inds. Ltd.,Jun-47,1980,1.01012E+14,1,Preparation and spinning of cotton fiber including blended* cotton,Cotton yarn,13111,Decile 2,INE837B01031
Winsome Yarns Ltd.,53-10566,1990,1.01012E+14,1,Preparation and spinning of cotton fiber including blended* cotton,Cotton yarn,13111,Decile 2,INE784B01035
Wonderla Holidays Ltd.,08-31224,2002,1.01042E+14,1,Other amusement and recreation activities n.e.c.,Amusement centres etc,93290,Decile 2,INE066O01014
X L Energy Ltd.,62-5844,1985,1.01014E+14,1,Manufacture of other electrical equipment,Solar modules,27900,Decile 2,INE183H01011
Zee Media Corpn. Ltd.,11-121506,1999,1.01042E+14,1,Television programming and broadcasting activities,Television broadcasting media,6020,Decile 2,INE966H01019
Zenith Infotech Ltd.,11-102705,1996,1.0104E+14,1,Wholesale of computers and computer peripheral equipment,Wholesale trade in computer systems and peripherals,46511,Decile 2,INE899A01017
